<!DOCTYPE config SYSTEM "../dtds/bootstrapConfig.dtd">
<bootstrap>
	<application>Scorpio Framework</application>
	<filename>bootstrap-core</filename>
	<fileLocation>temp</fileLocation>
	<classes>
		<class>baseSet</class>
		<class>baseOptionsSet</class>
		<class>baseTableParamSet</class>
		<class>baseObjectSet</class>
		<class>baseSearch</class>
		<class>baseSearchInterface</class>
		<class>baseResultSet</class>
		<class>systemDaoInterface</class>
		<class>systemDaoValidatorInterface</class>
		<class>system</class>
		<class>systemException</class>
		<class>systemAutoload</class>
		<class>systemAutoloadException</class>
		<class>systemConfigBase</class>
		<class>systemConfig</class>
		<class>systemConfigParam</class>
		<class>systemConfigParamSet</class>
		<class>systemConfigSection</class>
		<class>systemConfigException</class>
		<class>systemDateTime</class>
		<class>systemDateTimeZone</class>
		<class>systemDateEvent</class>
		<class>systemDateCalendar</class>
		<class>systemLocale</class>
		<class>systemEvent</class>
		<class>systemEventDispatcher</class>
		<class>systemLog</class>
		<class>systemLogException</class>
		<class>systemLogLevel</class>
		<class>systemLogFilter</class>
		<class>systemLogQueue</class>
		<class>systemLogSource</class>
		<class>systemLogWriter</class>
		<class>systemLogWriterFile</class>
		<class>systemRegistry</class>
		<class>systemRegistryException</class>
		<class>utilityStringFunction</class>
		<class>utilityXmlFunction</class>
		<class>dbManager</class>
		<class>dbOptions</class>
		<class>dbException</class>
	</classes>
</bootstrap>